ID,Type,SKU,Name,Published,Is featured?,Visibility in catalog,Short description,Description,Date sale price starts,Date sale price ends,Tax status,Tax class,In stock?,Stock,Low stock amount,Backorders allowed?,Sold individually?,Weight (kg),Length (cm),Width (cm),Height (cm),Allow customer reviews?,Purchase note,Sale price,Regular price,Categories,Tags,Shipping class,Images,Download limit,Download expiry days,Parent,Grouped products,Upsells,Cross-sells,External URL,Button text,Position
30735132491910,simple,,Hohner Compadre Acordeón Sol Rojo Mate con Parrilla Gris,1,0,visible,"Durante 100 años, Hohner se ha dedicado al progreso de las comunidades musi","Durante 100 años, Hohner se ha dedicado al progreso de las comunidades musicales vivas diversas y nuestra actual línea de acordeón puede contribuir a este objetivo como nunca antes. El acordeón Compadre, es un modelo diatónico de tres filas con un acabado de pintura mate similar al acordeón Panther, pero con una extensa gama de colores y con correa de bajos ajustable. Incluye mochila para su transportación y almacenamiento, además de un conjunto de correas. Perfecto para los acordeonistas intermedios, o aquellos que buscan comprar un segundo acordeón. ¡ La Mejor Calidad de Sonido en un Acordeón Que Tiene Los Mejores Componentes!",,,taxable,,1,1,,0,0,,,,,1,,,989.00,Hohner,,,https://accordionproshop.com/cdn/shop/files/Hohner-Compadre-Accordion-No-Switch-GCF-Matte-Red-with-Gray-accordion-www_hermesmusic_com_1600x.jpg?v=1715895184,,,,,,,,,0
31342657175686,simple,,Hohner Corona II Classic Acordeón Sol Negro,1,0,visible,"Usando la mano de obra de los días pasados, cada instrumento es terminado a","Usando la mano de obra de los días pasados, cada instrumento es terminado amorosamente en gran detalle. El teclado de madera cubierto de celuloide, da al instrumento un aspecto lujoso, y es su detalle más llamativo. Diseñado para músicos avanzados y profesionales, el sonido típico de HOHNER crea paisajes sónicos listos para la exploración y la reminiscencia para disfrutar el sonido, apariencia y sensación de un verdadero clásico. En el Corona Classic II, el sonido característico de estilos musicales como norteño, Tex-Mex, Vallenato y otros estilos similares, es combinado con la apariencia típica y sensación de la serie Corona de Hohner. El Corona se complace con una correa cómoda de bajo ajustable, una diafragma silenciosa y una acción dinámica de agudos y graves para una gran respuesta y sensación táctil. El Corona II Classic, está hecho especialmente para el músico profesional y ideal para el músico que demanda gran calidad y el sonido de HOHNER.",,,taxable,,1,1,,0,0,,,,,1,,,"2,059.00",Hohner,,,https://accordionproshop.com/cdn/shop/files/Hohner-Corona-II-Classic-GCF-Diatonic-Accordion-in-Black-accordion-www_hermesmusic_com_1600x.jpg?v=1715895180,,,,,,,,,0
21424071704636,simple,,Hohner Corona II Classic Acordeón Sol Rojo,1,0,visible,"Usando la mano de obra de los días pasados, cada instrumento es terminado a","Usando la mano de obra de los días pasados, cada instrumento es terminado amorosamente en gran detalle. El teclado de madera cubierto de celuloide en color a juego, da al instrumento un aspecto lujoso, y es su detalle más llamativo. Diseñado para músicos avanzados y profesionales, el sonido típico de HOHNER crea paisajes sónicos listos para la exploración y la reminiscencia para disfrutar el sonido, apariencia y sensación de un verdadero clásico. En el Corona Classic II, el sonido característico de estilos musicales como norteño, Tex-Mex, Vallenato y otros estilos similares, es combinado con la apariencia típica y sensación de la serie Corona de Hohner. El Corona se complace con una correa cómoda de bajo ajustable, una diafragma silenciosa y una acción dinámica de agudos y graves para una gran respuesta y sensación táctil. El Corona II Classic, está hecho especialmente para el músico profesional y ideal para el músico que demanda gran calidad y el sonido de HOHNER.",,,taxable,,1,1,,0,0,,,,,1,,,"2,059.00",Hohner,,,https://accordionproshop.com/cdn/shop/files/Hohner-Corona-II-Classic-GCF-Diatonic-Accordion-in-Red-accordion-www_hermesmusic_com_1600x.jpg?v=1715895202,,,,,,,,,0
34938009485446,simple,,Hohner Corona C-II Acordeón Sol Rojo a Oro,1,0,visible,"El nuevo y mejorado modelo Corona, el C-II, ha sido modificado para lograr ","El nuevo y mejorado modelo Corona, el C-II, ha sido modificado para lograr un rendimiento robusto por encima del estándar al actualizar la caja de resonancia y la placa base con aluminio, pero manteniendo el sonido característico de Corona que se espera de este modelo icónico. También viene con un mecanismo mejorado de agudos suaves. Nuevas funciones, nueva apariencia y un sonido increíble: todo lo que espera de un acordeón HOHNER profesional. El C-II viene en cuatro colores únicos: verde a dorado, rojo a dorado, arco iris plateado y arco iris blanco.",,,taxable,,1,1,,0,0,,,,,1,,,"2,169.00",Hohner,,,https://accordionproshop.com/cdn/shop/files/Hohner-Corona-C-II-Accordion-GCF-Red-to-Gold-accordion-www_hermesmusic_com_1600x.jpg?v=1716934299,,,,,,,,,0
9417382035516,simple,,Montanari 3112 G Acordeón Sin Registros MI Azul,1,0,visible,Los acordeones Montanari estan hechos para el Músico que busca lo elemental,"Los acordeones Montanari estan hechos para el Músico que busca lo elemental en un acordeón para el uso rudo del día a día. Es un acordeón de manufactura china con voces tipo a mano y afinación estilo italiana. Con estas simples especificaciones te garantizamos que el sonido de tu acordeón será el sonido perfecto para tu música norteña! Un sonido fuerte, claro, robusto y sobre todo con una calibración perfecta para interpretar tus melodías favoritas de nuestra querida música norteña. Cuenta con 31 botones de agudos (estilo italiano) y 12 botones de bajos con voces incluidas, además este modelo cuenta con parrilla metálica que le ofrece una mejor estética y sobre todo un mejor desempeño acústico, además de que su mecanismo cuenta con una mejor calidad en sus componentes, lo cual lo hace más suave al tacto, durable y rápido de respuesta a tu ejecución musical. Incluye correas y estuche.",,,taxable,,1,1,,0,0,,,,,1,,,629.00,Montanari,,,https://accordionproshop.com/cdn/shop/files/Montanari-3112-MG-Accordion-No-Switch-EAD-Blue-accordion-www_hermesmusic_com_1600x.jpg?v=1716573332,,,,,,,,,0
9356527468604,simple,,Montanari 3112 G Acordeón Sin Registros MI Negro,1,0,visible,Los acordeones Montanari estan hechos para el Músico que busca lo elemental,"Los acordeones Montanari estan hechos para el Músico que busca lo elemental en un acordeón para el uso rudo del día a día. Es un acordeón de manufactura china con voces tipo a mano y afinación estilo italiana. Con estas simples especificaciones te garantizamos que el sonido de tu acordeón será el sonido perfecto para tu música norteña! Un sonido fuerte, claro, robusto y sobre todo con una calibración perfecta para interpretar tus melodías favoritas de nuestra querida música norteña. Cuenta con 31 botones de agudos (estilo italiano) y 12 botones de bajos con voces incluidas, además este modelo cuenta con parrilla metálica que le ofrece una mejor estética y sobre todo un mejor desempeño acústico, además de que su mecanismo cuenta con una mejor calidad en sus componentes, lo cual lo hace más suave al tacto, durable y rápido de respuesta a tu ejecución musical . Incluye correas y estuche.",,,taxable,,1,1,,0,0,,,,,1,,,629.00,Montanari,,,https://accordionproshop.com/cdn/shop/files/Montanari-3112-MG-Accordion-EAD-Black-accordion-www_hermesmusic_com_1600x.jpg?v=1715352947,,,,,,,,,0
9437624664124,simple,,Montanari 3112 G Acordeón Sin Registros MI Rojo,1,0,visible,Los acordeones Montanari estan hechos para el Músico que busca lo elemental,"Los acordeones Montanari estan hechos para el Músico que busca lo elemental en un acordeón para el uso rudo del día a día. Es un acordeón de manufactura china con voces tipo a mano y afinación estilo italiana. Con estas simples especificaciones te garantizamos que el sonido de tu acordeón será el sonido perfecto para tu música norteña! Un sonido fuerte, claro, robusto y sobre todo con una calibración perfecta para interpretar tus melodías favoritas de nuestra querida música norteña. Cuenta con 31 botones de agudos (estilo italiano) y 12 botones de bajos con voces incluidas, además este modelo cuenta con parrilla metálica que le ofrece una mejor estética y sobre todo un mejor desempeño acústico, además de que su mecanismo cuenta con una mejor calidad en sus componentes, lo cual lo hace más suave al tacto, durable y rápido de respuesta a tu ejecución musical. Incluye correas y estuche.",,,taxable,,1,1,,0,0,,,,,1,,,629.00,Montanari,,,https://accordionproshop.com/cdn/shop/files/Montanari-3112-MG-Accordion-EAD-Red-accordion-www_hermesmusic_com_1600x.jpg?v=1715352997,,,,,,,,,0
39788788318342,simple,,Montanari 3112 MG Acordeón Sin Registros SOL Rojo,1,0,visible,Los acordeones Montanari están hechos especialmente para músicos que buscan,"Los acordeones Montanari están hechos especialmente para músicos que buscan lo básico en un acordeón para el uso diario. Es un acordeón de fabricación china con cajetines de estilo “hecho a mano” y afinación al estilo italiano. ¡Con estas simples especificaciones, le garantizamos que el sonido que sale de su acordeón será el sonido perfecto para su música norteña! Un sonido fuerte, claro, robusto y con una calibración perfecta para interpretar tus melodías favoritas de nuestra querida música norteña. Dispone de 31 botones de agudos (estilo italiano) y 12 de graves con tacos de lengüeta incluidos. Además, este modelo cuenta con una parrilla metálica que ofrece una mejor estética y un mejor rendimiento acústico general. Además, su mecanismo cuenta con componentes de mejor calidad, lo que lo hace más suave al tacto, duradero y de rápida respuesta respecto a tu interpretación musical. Incluye correas y estuche.",,,taxable,,1,1,,0,0,,,,,1,,,629.00,Montanari,,,https://accordionproshop.com/cdn/shop/files/Montanari-3112-MG-Accordion-GCF-Red-accordion-www_hermesmusic_com_1600x.jpg?v=1715793451,,,,,,,,,0
8862000939068,simple,,Hohner Corona II Xtreme Acordeón Sol Blanco,1,0,visible,"El acordeón Hohner Corona II Xtreme está equipado con cañas, fuelles y válv","El acordeón Hohner Corona II Xtreme está equipado con cañas, fuelles y válvulas finamente elaborados. Con botones aperladas y el teclado suave al tacto, son indicaciones de una construcción de calidad. Hohner también incluye soportes de doble correa, una correa de bajo ajustable, una almohadilla de espalda, correas de hombro acolchadas, y una bolsa de lujo de protección gig con el acordeón Corona II Xtreme. La artesanía cuidadosa y la selección de los mejores materiales garantizan un alto nivel de producción. La combinación de mano de obra experta y tecnología moderna es conocida mundialmente como la característica distintiva de los acordeones de gama alta de Hohner.",,,taxable,,1,1,,0,0,,,,,1,,,"2,479.00",Hohner,,,https://accordionproshop.com/cdn/shop/files/Hohner-Corona-II-Xtreme-GCF-White-accordion-www_hermesmusic_com_1600x.jpg?v=1715895223,,,,,,,,,0
40143225782406,simple,,Sonola L'Artigiana Acordeón Sin Registros FA Madera con Parilla Blanco,1,0,visible,"El nuevo modelo L’Artigiana fue elaborado con la mejor funcionalidad, sonid","El nuevo modelo L’Artigiana fue elaborado con la mejor funcionalidad, sonido y delicadeza que caracteriza a los acordeones de Sonola. Este acordeón de fabricación italiana elaborado en madera y con diseños en negro es de tamaño regular y peso ligero, lo que no compromete el gran sonido de este acordeón. Tiene 34 botones de agudos, 12 de bajos, 3 de lengüeta y sin interruptores, lo que hace de este nuevo modelo un acordeón completo manteniendo un gran sonido norteño. Por el lado acústico, este modelo, cuenta con una aleación de maderas finas y muy bien tratadas para obtener la mejor acústica de las voces que en este caso son “Artigiana” tipo a mano. Este modelo también contiene 3 lengüetas, 2 medianas y 1 grande, lo que significa que suena como un acordeón regular de 3 o 5 interruptores pero sin los interruptores, siendo el sonido principal el Master y ayuda a que este acordeón sea único. Todo esto se hace de manera artesanal y cuidando cada detalle en cada parte del proceso, en SONOLA ACCORDIONS® cada acordeón es tratado personalmente por los mejores artesanos de Italia. *Bloques de voz de bajo no incluidos",,,taxable,,1,1,,0,0,,,,,1,,,"3,699.00",Sonola,,,https://accordionproshop.com/cdn/shop/files/Sonola-LArtigiana-Accordion-No-Switch-FBE-Wood-with-White-Grill-accordion-www_hermesmusic_com_1600x.jpg?v=1715895020,,,,,,,,,0
40143225847942,simple,,Sonola L'Artigiana Acordeón Sin Registros FA Madera con Parilla Negra,1,0,visible,"El nuevo modelo L’Artigiana fue elaborado con la mejor funcionalidad, sonid","El nuevo modelo L’Artigiana fue elaborado con la mejor funcionalidad, sonido y delicadeza que caracteriza a los acordeones de Sonola. Este acordeón de fabricación italiana elaborado en madera y con diseños en negro es de tamaño regular y peso ligero, lo que no compromete el gran sonido de este acordeón. Tiene 34 botones de agudos, 12 de bajos, 3 de lengüeta y sin interruptores, lo que hace de este nuevo modelo un acordeón completo manteniendo un gran sonido norteño. Por el lado acústico, este modelo, cuenta con una aleación de maderas finas y muy bien tratadas para obtener la mejor acústica de las voces que en este caso son “Artigiana” tipo a mano. Este modelo también contiene 3 lengüetas, 2 medianas y 1 grande, lo que significa que suena como un acordeón regular de 3 o 5 interruptores pero sin los interruptores, siendo el sonido principal el Master y ayuda a que este acordeón sea único. Todo esto se hace de manera artesanal y cuidando cada detalle en cada parte del proceso, en SONOLA ACCORDIONS® cada acordeón es tratado personalmente por los mejores artesanos de Italia. *Bass Voice Blocks not included *Bloques de voz de bajo no incluidos",,,taxable,,1,1,,0,0,,,,,1,,,"3,699.00",Sonola,,,https://accordionproshop.com/cdn/shop/files/Sonola-LArtigiana-Accordion-No-Switch-FBE-Wood-with-Black-Grill-accordion-www_hermesmusic_com_1600x.jpg?v=1715895018,,,,,,,,,0
40143225815174,simple,,Sonola L'Artigiana Acordeon Sin Registros FA Madera con Parilla Marrón,1,0,visible,"El nuevo modelo L’Artigiana fue elaborado con la mejor funcionalidad, sonid","El nuevo modelo L’Artigiana fue elaborado con la mejor funcionalidad, sonido y delicadeza que caracteriza a los acordeones de Sonola. Este acordeón de fabricación italiana elaborado en madera y con diseños en negro es de tamaño regular y peso ligero, lo que no compromete el gran sonido de este acordeón. Tiene 34 botones de agudos, 12 de bajos, 3 de lengüeta y sin interruptores, lo que hace de este nuevo modelo un acordeón completo manteniendo un gran sonido norteño. Por el lado acústico, este modelo, cuenta con una aleación de maderas finas y muy bien tratadas para obtener la mejor acústica de las voces que en este caso son “Artigiana” tipo a mano. Este modelo también contiene 3 lengüetas, 2 medianas y 1 grande, lo que significa que suena como un acordeón regular de 3 o 5 interruptores pero sin los interruptores, siendo el sonido principal el Master y ayuda a que este acordeón sea único. Todo esto se hace de manera artesanal y cuidando cada detalle en cada parte del proceso, en SONOLA ACCORDIONS® cada acordeón es tratado personalmente por los mejores artesanos de Italia. *Bloques de voz de bajo no incluidos",,,taxable,,1,1,,0,0,,,,,1,,,"3,699.00",Sonola,,,https://accordionproshop.com/cdn/shop/files/Sonola-LArtigiana-Accordion-No-Switch-FBE-Wood-with-Brown-Grill-accordion-www_hermesmusic_com_1600x.jpg?v=1715895022,,,,,,,,,0
40143225946246,simple,,Sonola L'Artigiana Acordeon Sin Registros FA Madera con Parilla Dorado,1,0,visible,"El nuevo modelo L’Artigiana fue elaborado con la mejor funcionalidad, sonid","El nuevo modelo L’Artigiana fue elaborado con la mejor funcionalidad, sonido y delicadeza que caracteriza a los acordeones de Sonola. Este acordeón de fabricación italiana elaborado en madera y con diseños en negro es de tamaño regular y peso ligero, lo que no compromete el gran sonido de este acordeón. Tiene 34 botones de agudos, 12 de bajos, 3 de lengüeta y sin interruptores, lo que hace de este nuevo modelo un acordeón completo manteniendo un gran sonido norteño. Por el lado acústico, este modelo, cuenta con una aleación de maderas finas y muy bien tratadas para obtener la mejor acústica de las voces que en este caso son “Artigiana” tipo a mano. Este modelo también contiene 3 lengüetas, 2 medianas y 1 grande, lo que significa que suena como un acordeón regular de 3 o 5 interruptores pero sin los interruptores, siendo el sonido principal el Master y ayuda a que este acordeón sea único. Todo esto se hace de manera artesanal y cuidando cada detalle en cada parte del proceso, en SONOLA ACCORDIONS® cada acordeón es tratado personalmente por los mejores artesanos de Italia. *Bloques de voz de bajo no incluidos",,,taxable,,1,1,,0,0,,,,,1,,,"3,699.00",Sonola,,,https://accordionproshop.com/cdn/shop/files/Sonola-LArtigiana-Accordion-No-Switch-FBE-Wood-with-Gold-Grill-accordion-www_hermesmusic_com_1600x.jpg?v=1715895019,,,,,,,,,0
9035627102268,simple,,Hohner Corona II Xtreme Acordeón Mi Rojo,1,0,visible,"El acordeón Hohner Corona II Xtreme está equipado con cañas, fuelles y válv","El acordeón Hohner Corona II Xtreme está equipado con cañas, fuelles y válvulas finamente elaborados. Con botones aperladas y el teclado suave al tacto, son indicaciones de una construcción de calidad. Hohner también incluye soportes de doble correa, una correa de bajo ajustable, una almohadilla de espalda, correas de hombro acolchadas, y una bolsa de lujo de protección gig con el acordeón Corona II Xtreme. La artesanía cuidadosa y la selección de los mejores materiales garantizan un alto nivel de producción. La combinación de mano de obra experta y tecnología moderna es conocida mundialmente como la característica distintiva de los acordeones de gama alta de Hohner.",,,taxable,,1,1,,0,0,,,,,1,,,"2,479.00",Hohner,,,https://accordionproshop.com/cdn/shop/files/Hohner-Corona-II-Xtreme-EAD-Red-accordion-www_hermesmusic_com_1600x.jpg?v=1715895201,,,,,,,,,0
34943585517702,simple,,Hohner Corona C-II Acordeón SOL Verde a Dorado,1,0,visible,"El nuevo y mejorado modelo Corona, el C-II, ha sido modificado para lograr ","El nuevo y mejorado modelo Corona, el C-II, ha sido modificado para lograr un rendimiento robusto por encima del estándar al actualizar la caja de resonancia y la placa base con aluminio, pero manteniendo el sonido característico de Corona que se espera de este modelo icónico. También viene con un mecanismo mejorado de agudos suaves. Nuevas funciones, nueva apariencia y un sonido increíble: todo lo que espera de un acordeón HOHNER profesional. El C-II viene en cuatro colores únicos: verde a dorado, rojo a dorado, arco iris plateado y arco iris blanco.",,,taxable,,1,1,,0,0,,,,,1,,,"2,169.00",Hohner,,,https://accordionproshop.com/cdn/shop/files/Hohner-Corona-C-II-Accordion-GCF-Green-to-Gold-accordion-www_hermesmusic_com_1600x.jpg?v=1716305233,,,,,,,,,0
40148322091142,simple,,Cantabella Rustica II Acordeón Sin Registros MI Madera con Parilla Marron,1,0,visible,"El Cantabella Rústica tono Mi de válvula , es un acordeón de peso ligero qu","El Cantabella Rústica tono Mi de válvula , es un acordeón de peso ligero que ha sido diseñado pensando totalmente en su funcionalidad y su gran sonido, de color madera natural, para que su sonido pueda ser liberado de la mejor manera posible. Cuenta con 34 botones de agudos, lo cual lo convierte en un acordeón completo,  no contiene registros, ya que su tamaño es muy compacto y esto podría comprometer el sonido original del acordeón norteño en un cajón de maderas finas y dedicadas a un gran sonido. El Cantabella Rústica te ofrece además la opción de 12 botones de bajos tradicionales para un acordeón diatoníco. Este acordeón ha sido desarrollado con los mismos componentes 100% italianos de la mejor calidad, Voces Artigiana hechas a mano, maquinaria de aluminio zapatas soldadas a la manera tradicional con cera de la mejor calidad lo mismo que su montura de voces. Esto significa que el modelo Rústica te ofrece la mejor calidad de un acordeón italiano en un acordeón “ultra compacto” a menor costo que su homólogo de tamaño completo con o sin registros.El Cantabella Rústica es más pequeño que los acordeones alemanes o que los acordeones chinos de 31 botones de línea diatoníca; cuenta con 34 botones, a diferencia de los antes mencionados.",,,taxable,,1,1,,0,0,,,,,1,,,"3,699.00",Cantabella,,,https://accordionproshop.com/cdn/shop/files/Cantabella-Rustica-II-Accordion-No-Switch-EAD-Wood-with-Brown-Grill-accordion-www_hermesmusic_com_1600x.jpg?v=1715895014,,,,,,,,,0
40148322123910,simple,,Cantabella Rustica II Acordeón Sin Registros MI Madera con Parilla Dorado,1,0,visible,"El Cantabella Rústica tono Mi de válvula , es un acordeón de peso ligero qu","El Cantabella Rústica tono Mi de válvula , es un acordeón de peso ligero que ha sido diseñado pensando totalmente en su funcionalidad y su gran sonido, de color madera natural, para que su sonido pueda ser liberado de la mejor manera posible. Cuenta con 34 botones de agudos, lo cual lo convierte en un acordeón completo,  no contiene registros, ya que su tamaño es muy compacto y esto podría comprometer el sonido original del acordeón norteño en un cajón de maderas finas y dedicadas a un gran sonido. El Cantabella Rústica te ofrece además la opción de 12 botones de bajos tradicionales para un acordeón diatoníco. Este acordeón ha sido desarrollado con los mismos componentes 100% italianos de la mejor calidad, Voces Artigiana hechas a mano, maquinaria de aluminio zapatas soldadas a la manera tradicional con cera de la mejor calidad lo mismo que su montura de voces. Esto significa que el modelo Rústica te ofrece la mejor calidad de un acordeón italiano en un acordeón “ultra compacto” a menor costo que su homólogo de tamaño completo con o sin registros.El Cantabella Rústica es más pequeño que los acordeones alemanes o que los acordeones chinos de 31 botones de línea diatoníca; cuenta con 34 botones, a diferencia de los antes mencionados.",,,taxable,,1,1,,0,0,,,,,1,,,"3,699.00",Cantabella,,,https://accordionproshop.com/cdn/shop/files/Cantabella-Rustica-II-Accordion-No-Switch-EAD-Wood-with-Gold-Grill-accordion-www_hermesmusic_com_1600x.jpg?v=1715895011,,,,,,,,,0
40148322189446,simple,,Cantabella Rustica II Acordeón Sin Registros MI Madera con Parilla Negro,1,0,visible,"El Cantabella Rústica tono Mi de válvula , es un acordeón de peso ligero qu","El Cantabella Rústica tono Mi de válvula , es un acordeón de peso ligero que ha sido diseñado pensando totalmente en su funcionalidad y su gran sonido, de color madera natural, para que su sonido pueda ser liberado de la mejor manera posible. Cuenta con 34 botones de agudos, lo cual lo convierte en un acordeón completo,  no contiene registros, ya que su tamaño es muy compacto y esto podría comprometer el sonido original del acordeón norteño en un cajón de maderas finas y dedicadas a un gran sonido. El Cantabella Rústica te ofrece además la opción de 12 botones de bajos tradicionales para un acordeón diatoníco. Este acordeón ha sido desarrollado con los mismos componentes 100% italianos de la mejor calidad, Voces Artigiana hechas a mano, maquinaria de aluminio zapatas soldadas a la manera tradicional con cera de la mejor calidad lo mismo que su montura de voces. Esto significa que el modelo Rústica te ofrece la mejor calidad de un acordeón italiano en un acordeón “ultra compacto” a menor costo que su homólogo de tamaño completo con o sin registros.El Cantabella Rústica es más pequeño que los acordeones alemanes o que los acordeones chinos de 31 botones de línea diatoníca; cuenta con 34 botones, a diferencia de los antes mencionados.",,,taxable,,1,1,,0,0,,,,,1,,,"3,699.00",Cantabella,,,https://accordionproshop.com/cdn/shop/files/Cantabella-Rustica-II-Accordion-No-Switch-EAD-Wood-with-Black-Grill-accordion-www_hermesmusic_com_1600x.jpg?v=1715895020,,,,,,,,,0
