31715510845574,simple,,Hohner Corona II Acordeón Sin Registros FA Negro,1,0,visible,"Durante 100 años, Hohner se ha dedicado al progreso de las comunidades musi","Durante 100 años, Hohner se ha dedicado al progreso de las comunidades musicales vivas y diversas y nuestra actual línea de acordeones puede contribuir a este objetivo como nunca antes. ¡La Mejor Calidad de Sonido en un Acordeón Que Tiene Los Mejores Componentes! Hohner Corona, esta fabricado con los mejores componentes. El Corona II Acordeón diatónico, es un favorito desde hace mucho tiempo y es absolutamente atesorado por los músicos tradicionales.",,,taxable,,1,1,,0,0,,,,,1,,,"1,399.00",Hohner,,,https://accordionproshop.com/cdn/shop/files/Hohner-Corona-II-Accordion-FBE-Black-accordion-www_hermesmusic_com_1600x.jpg?v=1715352958,,,,,,,,,0
31715633397894,simple,,Hohner Corona II Acordeón Sin Registros SOL Blanco,1,0,visible,"Durante 100 años, Hohner se ha dedicado al progreso de las comunidades musi","Durante 100 años, Hohner se ha dedicado al progreso de las comunidades musicales vivas y diversas y nuestra actual línea de acordeones puede contribuir a este objetivo como nunca antes. ¡La Mejor Calidad de Sonido en un Acordeón Que Tiene Los Mejores Componentes! Hohner Corona, esta fabricado con los mejores componentes. El Corona II Acordeón diatónico, es un favorito desde hace mucho tiempo y es absolutamente atesorado por los músicos tradicionales.",,,taxable,,1,1,,0,0,,,,,1,,,"1,399.00",Hohner,,,https://accordionproshop.com/cdn/shop/files/Hohner-Corona-II-GCF-Pearl-White-Accordion-accordion-www_hermesmusic_com_1600x.jpg?v=1715352912,,,,,,,,,0
31715510648966,simple,,Hohner Corona II Acordeón Sin Registros FA Rojo,1,0,visible,"Durante 100 años, Hohner se ha dedicado al progreso de las comunidades musi","Durante 100 años, Hohner se ha dedicado al progreso de las comunidades musicales vivas y diversas y nuestra actual línea de acordeones puede contribuir a este objetivo como nunca antes. ¡La Mejor Calidad de Sonido en un Acordeón Que Tiene Los Mejores Componentes! Hohner Corona, esta fabricado con los mejores componentes. El Corona II Acordeón diatónico, es un favorito desde hace mucho tiempo y es absolutamente atesorado por los músicos tradicionales.",,,taxable,,1,1,,0,0,,,,,1,,,"1,399.00",Hohner,,,https://accordionproshop.com/cdn/shop/files/Hohner-Corona-II-Accordion-FBE-Red-accordion-www_hermesmusic_com_1600x.jpg?v=1715352934,,,,,,,,,0
30891370315910,simple,,Paquete Compadre Fa Naranja Parrilla Gris con Correas Cantabella,1,0,visible,Este paquete de Hohner Compadre incluye: Hohner Compadre Naranja Sol: COFO-,Este paquete de Hohner Compadre incluye: Hohner Compadre Naranja Sol: COFO-N(1) Correas Cantabella Color Negro: 3FTR0068 BLK/BLK W/TAG(1),,,taxable,,1,1,,0,0,,,,,1,,,999.00,Hermes Music,,,https://accordionproshop.com/cdn/shop/files/Hohner-Compadre-FBE-Orange-with-Gray-Grill-and-Cantabella-Straps-Bundle-accordion-www_hermesmusic_com_1600x.jpg?v=1715352922,,,,,,,,,0
40148321697926,simple,,Cantabella Rustica II Acordeón Sin Registros FA Madera con Parilla Marron,1,0,visible,"El Cantabella Rústica II tono Fa de válvula , es un acordeón de peso ligero","El Cantabella Rústica II tono Fa de válvula , es un acordeón de peso ligero que ha sido diseñado pensando totalmente en su funcionalidad y su gran sonido, de color madera natural, para que su sonido pueda ser liberado de la mejor manera posible. Cuenta con 34 botones de agudos, lo cual lo convierte en un acordeón completo,  no contiene registros, ya que su tamaño es muy compacto y esto podría comprometer el sonido original del acordeón norteño en un cajón de maderas finas y dedicadas a un gran sonido. El Cantabella Rústica te ofrece además la opción de 12 botones de bajos tradicionales para un acordeón diatoníco. Este acordeón ha sido desarrollado con los mismos componentes 100% italianos de la mejor calidad, Voces Artigiana hechas a mano, maquinaria de aluminio zapatas soldadas a la manera tradicional con cera de la mejor calidad lo mismo que su montura de voces. Esto significa que el modelo Rústica te ofrece la mejor calidad de un acordeón italiano en un acordeón “ultra compacto” a menor costo que su homólogo de tamaño completo con o sin registros.El Cantabella Rústica es más pequeño que los acordeones alemanes o que los acordeones chinos de 31 botones de línea diatoníca; cuenta con 34 botones, a diferencia de los antes mencionados.",,,taxable,,1,1,,0,0,,,,,1,,,"3,699.00",Cantabella,,,https://accordionproshop.com/cdn/shop/files/Cantabella-Rustica-II-Accordion-No-Switch-FBE-Wood-with-Brown-Grill-accordion-www_hermesmusic_com_1600x.jpg?v=1715895016,,,,,,,,,0
30735132196998,simple,,Hohner Compadre Acordeón Sin Registros Fa Rojo Mate con Parrilla Gris,1,0,visible,"Durante 100 años, Hohner se ha dedicado al progreso de las comunidades musi","Durante 100 años, Hohner se ha dedicado al progreso de las comunidades musicales vivas y diversas y nuestra actual línea de acordeón puede contribuir a este objetivo como nunca antes. El acordeón Compadre, es un modelo diatónico de tres filas con un acabado de pintura mate similar al acordeón Panther, pero con una extensa gama de colores y con correa de bajos ajustable. Incluye mochila para su transportación y almacenamiento, además de un conjunto de correas. Perfecto para los acordeonistas intermedios, o aquellos que buscan comprar un segundo acordeón. ¡ La Mejor Calidad de Sonido en un Acordeón Que Contiene Los Mejores Componentes!",,,taxable,,1,1,,0,0,,,,,1,,,989.00,Hohner,,,https://accordionproshop.com/cdn/shop/files/Hohner-Compadre-FBE-Red-with-Matte-Gray-Grill-accordion-www_hermesmusic_com_1600x.jpg?v=1717180870,,,,,,,,,0
30891370184838,simple,,Paquete Compadre Fa Rojo con Parrilla Gris con Correas Cantabella,1,0,visible,Este paquete de Hohner Compadre incluye: Hohner Compadre Rojo Mi: COFR-N(1),Este paquete de Hohner Compadre incluye: Hohner Compadre Rojo Mi: COFR-N(1) Correas Cantabella Color Negro: 3FTR0068 BLK/BLK W/TAG(1),,,taxable,,1,1,,0,0,,,,,1,,,999.00,Hermes Music,,,https://accordionproshop.com/cdn/shop/files/Hohner-Compadre-FBE-Red-with-Gray-Grill-and-Cantabella-Straps-Bundle-accordion-www_hermesmusic_com_1600x.jpg?v=1717180928,,,,,,,,,0
31442110316678,simple,,Hohner Compadre Acordeón Sin Registros Mi Negro con Parrilla Gris Mate,1,0,visible,"Durante 100 años, Hohner se ha dedicado al progreso de las comunidades musi","Durante 100 años, Hohner se ha dedicado al progreso de las comunidades musicales vivas y diversas y nuestra actual línea de acordeones puede contribuir a este objetivo como nunca antes. El acordeón Compadre con su nueva parrilla gris mate, es un modelo diatónico de tres filas con un acabado de pintura mate similar al acordeón Panther, pero con una extensa gama de colores y con correa de bajos ajustable. Incluye mochila para su transportación y almacenamiento, además de un conjunto de correas. Perfecto para los acordeonistas intermedios, o aquellos que buscan comprar un segundo acordeón. ¡ La Mejor Calidad de Sonido en un Acordeón Que Contiene Los Mejores Componentes!",,,taxable,,1,1,,0,0,,,,,1,,,989.00,Hohner,,,https://accordionproshop.com/cdn/shop/files/Hohner-Compadre-EAD-Black-with-Matte-Gray-Grill-accordion-www_hermesmusic_com_1600x.jpg?v=1715895150,,,,,,,,,0
